title,text
Технологическая компания представила новый смартфон,Сегодня компания показала новый смартфон с улучшенной камерой и производительностью. Продажи начнутся в следующем месяце.
В Москве ожидается сильный снегопад,"По прогнозам синоптиков, в Москве ожидается сильный снегопад и резкое ухудшение погодных условий."
Новый закон о защите персональных данных вступает в силу,С завтрашнего дня начинает действовать закон о защите персональных данных. Эксперты оценивают его как шаг к большей безопасности пользователей.
Исследование показало рост популярности онлайн-образования,По данным нового исследования интерес к онлайн-курсам вырос на 35% за последний год.
Спортивная команда выиграла национальный чемпионат,В напряженном финале команда одержала победу и завоевала титул чемпионов страны.
Компания объявила о запуске новой платформы,"Компания представила платформу для малого бизнеса, которая поможет оптимизировать процессы и повысить эффективность."
Учёные нашли новый способ борьбы с вирусами,"Исследователи разработали метод, который ускоряет обнаружение вирусов и снижает риск заражения."
Международная выставка искусств открылась в столице,Выставка собрала работы современных художников со всего мира и привлекла тысячи посетителей.
Городские власти планируют строительство нового парка,"Новый парк будет включать спортивные площадки, зоны отдыха и велосипедные дорожки."
Технологический стартап получил крупные инвестиции,Стартап привлек 10 миллионов долларов на развитие инновационного проекта.
Новые правила дорожного движения вступают в силу,"С сегодняшнего дня вступают в силу изменения в правилах, касающиеся скоростного режима и парковки."
Проект по сохранению лесов получил грант,"Организация, занимающаяся охраной природы, получила финансирование на проекты по восстановлению лесных массивов."
Известный писатель выпустил новый роман,"Роман рассказывает о путешествиях и личностном росте главного героя, получив положительные отзывы критиков."
Местные фермеры отмечают рост урожая,"По оценкам специалистов, урожай в этом году выше среднего, что радует сельскохозяйственные хозяйства региона."
Компания внедрила систему искусственного интеллекта,Новая система поможет ускорить обработку данных и улучшить обслуживание клиентов.
Городские школы перешли на дистанционное обучение,Из-за погодных условий и ремонтных работ школы временно перешли на онлайн-формат занятий.
Новая выставка технологий открыта для посетителей,"Выставка демонстрирует роботов, умные гаджеты и инновационные решения для дома и офиса."
Экологическая инициатива собрала тысячи участников,"Акция по уборке рек и парков прошла успешно, тысячи жителей приняли участие."
Медицинские исследования показывают рост эффективности вакцин,Последние исследования подтверждают высокую эффективность новых вакцин против сезонных заболеваний.
Местные музеи предлагают бесплатный вход на выходных,Все музеи города будут открыты бесплатно для посетителей в эти выходные.
Авиакомпания открывает новые маршруты,Компания запускает рейсы в пять новых городов и расширяет международное сообщение.
Новое приложение для здоровья стало популярным,"Приложение позволяет отслеживать физическую активность, питание и уровень стресса пользователей."
Городской транспорт обновил подвижной состав,Новые автобусы и трамваи оснащены современными системами безопасности и комфорта.
В столице проходит международный музыкальный фестиваль,Фестиваль собрал исполнителей из разных стран и предложил разнообразную программу для гостей.
Учёные представили инновационные материалы,Новые материалы обладают повышенной прочностью и устойчивостью к высоким температурам.
Компания запускает образовательную программу для школьников,Программа направлена на развитие навыков программирования и критического мышления.
В регионе открыли новый центр науки и технологий,Центр предоставит возможности для исследований и обучения студентов и специалистов.
Новый фильм режиссера стал лидером проката,Фильм получил высокие оценки критиков и собрал рекордную кассу в первые дни показа.
Туристический сезон обещает быть рекордным,"По прогнозам экспертов, поток туристов в этом году превысит показатели прошлого года."
Городские власти проводят модернизацию инфраструктуры,"Работы включают ремонт дорог, освещения и благоустройство общественных пространств."
Компания анонсировала новые гаджеты для дома,"Продукты включают умные колонки, системы безопасности и энергосберегающие устройства."
Исследования показывают улучшение качества воздуха,Снижение выбросов и новые экологические меры положительно сказались на воздухе в мегаполисе.
Новые законы о труде вступают в силу,"Законы регулируют рабочее время, отпуска и права сотрудников на безопасные условия труда."
Местные спортивные соревнования собрали рекордное количество участников,"Соревнования прошли успешно, привлекая внимание как спортсменов, так и зрителей."
Компания внедрила систему удаленной работы,"Сотрудники могут работать из дома, что повысило производительность и снизило затраты на офис."
Новый культурный центр открыл двери для посетителей,"Центр предложит выставки, мастер-классы и лекции для жителей города."
Городской музей обновил экспозицию,Новая экспозиция посвящена истории города и современному искусству.
Финансовый рынок показывает рост инвестиций,Рост вложений в акции и облигации свидетельствует о повышенном интересе инвесторов.
Компания анонсировала новую линейку продуктов,Продукты ориентированы на молодых потребителей и включают инновационные решения.
Местные театры представляют новые постановки,Спектакли вызывают большой интерес публики и положительные отзывы критиков.
Учёные разработали метод очистки воды,Новая технология позволяет снизить уровень загрязнений и улучшить качество питьевой воды.
Городская библиотека расширяет фонд литературы,"Библиотека получила новые книги, включая классику и современные бестселлеры."
Новые исследования показывают рост интереса к экологии,"С каждым годом увеличивается количество людей, заботящихся о сохранении окружающей среды."
Местные фермерские рынки предлагают свежие продукты,"Жители города могут приобрести овощи, фрукты и изделия местных производителей."
Компания провела ребрендинг,Новый логотип и корпоративный стиль отражают инновационный подход компании.
В регионе открылся новый спортивный комплекс,"Комплекс оснащен бассейном, залами для командных и индивидуальных видов спорта."
Городская администрация проводит опрос жителей,Опрос направлен на улучшение качества жизни и учет мнения горожан.
Технологические компании объединяются для совместного проекта,Проект направлен на развитие искусственного интеллекта и робототехники.
Новые меры безопасности вводятся на транспорте,Повышенные меры контроля и камеры помогут снизить количество нарушений и аварий.
Учёные объявили о прорыве в биотехнологиях,Разработка позволит создавать более эффективные лекарства и методы лечения заболеваний.
